{
  "schema_version": 1,
  "evaluation_id": "evaluation-1",
  "project_id": "project-1",
  "object_version": 1,
  "definition_ref": { "object_id": "emotional-contrast-introduction", "object_version": 1, "digest": "aaaaaaaaaaaaaaaaaaaaaaaaaaaaaaaaaaaaaaaaaaaaaaaaaaaaaaaaaaaaaaaa" },
  "contract_ref": { "object_id": "contract-1", "object_version": 2, "digest": "bbbbbbbbbbbbbbbbbbbbbbbbbbbbbbbbbbbbbbbbbbbbbbbbbbbbbbbbbbbbbbbb" },
  "material_pack_ref": { "object_id": "pack-1", "object_version": 1, "digest": "cccccccccccccccccccccccccccccccccccccccccccccccccccccccccccccccc" },
  "input_fingerprint": "dddddddddddddddddddddddddddddddddddddddddddddddddddddddddddddddd",
  "context_tags": ["personal-story", "reaction-evidenced"],
  "result": "applicable",
  "required_evidence": ["reaction"],
  "available_evidence": ["asr:1"],
  "parameter_values": { "intensity": "moderate" },
  "matched_rule_ids": ["reaction-first"],
  "conflict_ids": [],
  "score": 1,
  "confidence": 1,
  "confidence_basis": "1 of 1 required evidence groups is satisfied by approved Evidence.",
  "reason": "Required approved reaction evidence and context are present.",
  "risks": [],
  "alternatives": ["chronological opening"],
  "output_kinds": ["direction_proposal", "story_proposal"],
  "evaluated_at": "2026-08-24T00:01:00.000Z",
  "provenance": { "producer": "project-host", "evaluator_version": "skill-evaluator-v1", "policy_version": "knowledge-v1", "input_refs": ["contract-1", "pack-1"], "unresolved_assumptions": [] }
}
